{
  "schemaVersion": 1,
  "id": "goldbach",
  "name": "Goldbach",
  "version": "0.1.0",
  "status": "draft",
  "modes": {
    "light": {
      "background": "#ffffff",
      "foreground": "#000000",
      "card": "#ffffff",
      "card-foreground": "#000000",
      "popover": "#ffffff",
      "popover-foreground": "#000000",
      "primary": "#b61f34",
      "primary-foreground": "#ffffff",
      "primary-hover": "#8d1926",
      "primary-hover-foreground": "#ffffff",
      "secondary": "#f2f2f2",
      "secondary-foreground": "#000000",
      "muted": "#f2f2f2",
      "muted-foreground": "#575757",
      "accent": "#f2f2f2",
      "accent-foreground": "#000000",
      "destructive": "#a21b32",
      "destructive-foreground": "#ffffff",
      "success": "#12633b",
      "success-foreground": "#ffffff",
      "warning": "#755000",
      "warning-foreground": "#ffffff",
      "border": "#dadada",
      "input": "#878787",
      "ring": "#575757"
    }
  },
  "typography": {
    "family": "Inter, Arial, sans-serif",
    "bodyWeight": 300,
    "headingWeight": 700
  },
  "shape": {
    "radius": "4px",
    "shadow": "none",
    "buttonMinHeight": "44px"
  },
  "sources": [
    "brands/goldbach/sources/DESIGN.md",
    "brands/goldbach/sources/IMAGERY.md"
  ]
}
