{
  "schemaVersion": 1,
  "id": "sygnum",
  "name": "Sygnum",
  "version": "0.2.0",
  "status": "draft",
  "palette": {
    "coral": "#F04E69",
    "ink": "#4C495F",
    "slate": "#6E6D7F",
    "lavender": "#C3C2D1",
    "mist": "#E6E7E8",
    "frost": "#CCDDE7",
    "lilac": "#C7B2D6",
    "rose": "#F8ABAD",
    "magenta": "#ED1968"
  },
  "modes": {
    "light": {
      "background": "#FFFFFF",
      "foreground": "#4C495F",
      "card": "#FFFFFF",
      "card-foreground": "#4C495F",
      "popover": "#FFFFFF",
      "popover-foreground": "#4C495F",
      "primary": "#C32D4F",
      "primary-foreground": "#FFFFFF",
      "primary-hover": "#A52642",
      "primary-hover-foreground": "#FFFFFF",
      "secondary": "#E6E7E8",
      "secondary-foreground": "#4C495F",
      "muted": "#F5F4F8",
      "muted-foreground": "#6E6D7F",
      "accent": "#D8D6E3",
      "accent-foreground": "#4C495F",
      "destructive": "#B42338",
      "destructive-foreground": "#FFFFFF",
      "success": "#23644D",
      "success-foreground": "#FFFFFF",
      "warning": "#795414",
      "warning-foreground": "#FFFFFF",
      "border": "#D8D6E3",
      "input": "#6E6D7F",
      "ring": "#C32D4F"
    }
  },
  "typography": {
    "family": "Benton Sans, Inter, Arial, sans-serif",
    "bodyWeight": 300,
    "headingWeight": 300,
    "bodyFamily": "Benton Sans Light",
    "headingFamily": "Neusa Next Std Light"
  },
  "shape": {
    "radius": "4px",
    "shadow": "none",
    "buttonMinHeight": "44px"
  },
  "tokens": {
    "lineHeight": {
      "tight": 1.15,
      "heading": 1.25,
      "body": 1.65
    },
    "fontWeight": {
      "regular": 400,
      "medium": 500,
      "semibold": 600,
      "bold": 700
    }
  },
  "presentation": {
    "editorialDarkSurfaces": true,
    "preferredDiagramShare": "2-4 per 12 slides",
    "preferredGenAiImages": "max 3 per 12 slides",
    "preferIconsForConcepts": true,
    "preferMermaidForSystems": true,
    "logoOnCover": true
  },
  "genAI": {
    "contract": "brands/sygnum/sources/GENAI.md",
    "families": ["swiss-roots-global-infrastructure", "human-stewardship", "secure-digital-infrastructure"],
    "maxKeyVisualsPer12Slides": 3,
    "logoGeneratedInImage": false
  },
  "sources": [
    "brands/sygnum/sources/DESIGN.md",
    "brands/sygnum/sources/IMAGERY.md",
    "brands/sygnum/sources/GENAI.md",
    "brands/sygnum/sources/sources.json",
    "brands/sygnum/sources/observations.json"
  ],
  "assets": {
    "logo": {
      "path": "brands/sygnum/logo.png",
      "aspectRatio": 3.7037037037037037,
      "background": "#FFFFFF",
      "padding": 0.08
    }
  }
}
