{
  "schemaVersion": 1,
  "id": "neutral",
  "name": "Framework",
  "version": "0.1.0",
  "status": "baseline",
  "modes": {
    "light": {
      "background": "#f6f7f9",
      "foreground": "#16181d",
      "card": "#ffffff",
      "card-foreground": "#16181d",
      "popover": "#ffffff",
      "popover-foreground": "#16181d",
      "primary": "#263b70",
      "primary-foreground": "#ffffff",
      "primary-hover": "#17264a",
      "primary-hover-foreground": "#ffffff",
      "secondary": "#e8ebf1",
      "secondary-foreground": "#16181d",
      "muted": "#e8ebf1",
      "muted-foreground": "#505866",
      "accent": "#e8ebf1",
      "accent-foreground": "#16181d",
      "destructive": "#a21b32",
      "destructive-foreground": "#ffffff",
      "success": "#12633b",
      "success-foreground": "#ffffff",
      "warning": "#755000",
      "warning-foreground": "#ffffff",
      "border": "#ced2da",
      "input": "#737b88",
      "ring": "#263b70"
    },
    "dark": {
      "background": "#11141b",
      "foreground": "#f4f6fb",
      "card": "#1b202b",
      "card-foreground": "#f4f6fb",
      "popover": "#232a38",
      "popover-foreground": "#f4f6fb",
      "primary": "#adc4ff",
      "primary-foreground": "#142345",
      "primary-hover": "#cad8ff",
      "primary-hover-foreground": "#142345",
      "secondary": "#2c3443",
      "secondary-foreground": "#f4f6fb",
      "muted": "#2c3443",
      "muted-foreground": "#b9c2d3",
      "accent": "#2c3443",
      "accent-foreground": "#f4f6fb",
      "destructive": "#ffb0b8",
      "destructive-foreground": "#4c0714",
      "success": "#91e7b7",
      "success-foreground": "#083820",
      "warning": "#f7d986",
      "warning-foreground": "#392a00",
      "border": "#465064",
      "input": "#7d89a0",
      "ring": "#adc4ff"
    }
  },
  "typography": {
    "family": "Arial, Helvetica, sans-serif",
    "bodyWeight": 400,
    "headingWeight": 700
  },
  "shape": {
    "radius": "8px",
    "shadow": "none",
    "buttonMinHeight": "44px"
  },
  "sources": []
}
